{"$id":"https://openline.example/schemas/bureau.receipt.v0.1","$schema":"http://json-schema.org/draft-07/schema#","additionalProperties":true,"description":"Minimal evidence format for a non-OpenLine receiver to report a consequence decision. Claim-backed: every field exists to support at least one bounded claim in claims.md. Unknown stays unknown: absent fields mean 'not evidenced', never 'false'.","properties":{"action":{"description":"What was attempted. Supports ACTION_ATTEMPT_OBSERVED.","properties":{"action_id":{"description":"Idempotency/correlation id. Required for REPLAY_ATTEMPT_OBSERVED.","type":"string"},"target":{"description":"What the action targeted, e.g. 'staging'.","type":"string"},"type":{"description":"Action kind, e.g. 'deploy'. Free-form; preserved verbatim.","type":"string"}},"type":"object"},"actor":{"description":"The worker/agent that acted or attempted to act (optional). Identity alone proves nothing about permission.","type":"string"},"authority":{"description":"The authority standing under which the receiver acted.","properties":{"authority_id":{"type":"string"},"issued_at":{"description":"ISO-8601 issuance time.","type":"string"},"revoked_at":{"description":"ISO-8601 revocation time. Receiver-external and unsigned unless provenance says otherwise; does not by itself prove enforcement.","type":"string"},"status":{"description":"Asserted standing. A status alone does not prove propagation or current authorization.","enum":["ACTIVE","REVOKED","SUPERSEDED","NARROWED","EXPIRED","NO_MANDATE","UNKNOWN"],"type":"string"}},"type":"object"},"decision":{"description":"The receiver's decision. Supports RECEIVER_DECISION_OBSERVED. A decision is not an effect.","properties":{"outcome":{"description":"COMMIT: consequence allowed. DENY: refused by policy. QUARANTINE: held. STOPPED: halted. OBSERVED: no decision taken, report only.","enum":["COMMIT","DENY","QUARANTINE","STOPPED","OBSERVED"],"type":"string"},"reason":{"description":"Machine or human reason, e.g. 'MANDATE_REVOKED'. Free-form; preserved verbatim.","type":"string"}},"type":"object"},"effect":{"description":"Downstream consequence observation. Absent or null means unknown, not 'no effect'.","properties":{"effect_id":{"type":"string"},"observed":{"description":"true: receiver reports an effect occurred. false: receiver asserts no effect occurred (attested, not independently verified). null/absent: unknown.","type":["boolean","null"]},"observed_at":{"description":"ISO-8601 time the effect was observed.","type":"string"}},"type":"object"},"extensions":{"description":"Vendor-neutral extension namespace. Convention: 'successor_of' names the superseded authority id; 'stale_artifact' carries {artifact_id, origin_authority_id, produced_at}. Namespaced keys (e.g. 'acme.example/field') are encouraged for vendor fields. Unknown extension content is preserved, never rejected.","type":"object"},"parents":{"description":"Receipt ids this receipt descends from (revocation notices, prior grants). Enables PROVENANCE_CHAIN_OBSERVED and ancestry in the Bureau.","items":{"type":"string"},"type":"array"},"principal":{"description":"The owner on whose behalf authority exists (optional).","type":"string"},"provenance":{"description":"Source-system attestation. Optional in v0.1; absence is reported, not punished.","properties":{"hash":{"description":"Hash binding the receipt to its payload (algorithm in value, e.g. 'sha256:...').","type":"string"},"signature":{"description":"Detached signature over the receipt (algorithm in value). Preserved and exposed; verification is the receiver's consumer's job.","type":"string"},"source_ref":{"description":"Pointer to the source record (log path, row id).","type":"string"},"system":{"description":"Name of the producing system.","type":"string"}},"type":"object"},"receipt_id":{"description":"Unique identifier for this receipt within the emitting system.","minLength":1,"type":"string"},"receipt_version":{"const":"bureau.receipt.v0.1","description":"Format version. Unknown versions are reported as UNSUPPORTED_VERSION, not INVALID.","type":"string"},"receiver":{"description":"Self-asserted identity of the receiver that produced this receipt. Self-asserted: not trusted unless bound by hash/signature (see provenance).","minLength":1,"type":"string"},"timestamp":{"description":"ISO-8601 time the receipt was produced (the observation time, not the effect time).","type":"string"}},"required":["receipt_version","receipt_id","timestamp","receiver"],"title":"Bureau external consequence receipt v0.1","type":"object"}