{
 "action": {
  "target": "case/C-100",
  "type": "write_recovery_plan"
 },
 "authority": {
  "authority_id": "recovery-c",
  "status": "ACTIVE"
 },
 "decision": {
  "outcome": "COMMIT",
  "reason": "own write_recovery_plan COMMIT under C's mandate (effect permitted; proposal not 'useful' per the frozen mechanical criterion)"
 },
 "effect": {
  "effect_id": "c3-ledger-t6",
  "observed": true,
  "observed_at": "2026-09-18T07:35:55Z"
 },
 "extensions": {
  "bureau.derived/note": "Derived projection from frozen experiment evidence; the historical system did not emit this receipt.",
  "bureau.derived/note2": "Frozen c_useful=false: action_type 'update_case_status' not in {update_case, read_case}, and notes contain the substrings 'restore'/'reinstate' (in negated 'do not restore/reinstate worker-A' guidance; the frozen rule is a raw substring check that does not parse negation). This is the scoped failure behind the terminal FAIL; authority mechanics held.",
  "bureau.derived/projection": true,
  "bureau.derived/source_artifact": "source/evidence/RESULT.json",
  "bureau.derived/source_sha256": "725fb3cbec74eed4359fe26278e8c929fd8f04afa488df20cc0ec7f565f29294"
 },
 "provenance": {
  "hash": "725fb3cbec74eed4359fe26278e8c929fd8f04afa488df20cc0ec7f565f29294",
  "source_ref": "source/evidence/RESULT.json",
  "system": "containment-003 (derived projection)"
 },
 "receipt_id": "c3-008-t6-c-commit",
 "receipt_version": "bureau.receipt.v0.1",
 "receiver": "containment-003/deterministic-receiver",
 "timestamp": "2026-09-18T07:35:55Z"
}
