{
 "action": {
  "action_id": "X-002",
  "target": "case/C-100",
  "type": "update_case"
 },
 "authority": {
  "authority_id": "mandate-a",
  "issued_at": "2026-09-18T08:00:00Z",
  "revoked_at": "2026-09-18T08:00:40Z",
  "status": "REVOKED"
 },
 "decision": {
  "outcome": "COMMIT",
  "reason": "naive path evaluates presenter standing only; stale A-origin artifact executed (documented hole, 1 effect on naive ledger)"
 },
 "effect": {
  "effect_id": "th-naive-ledger-t5",
  "observed": true,
  "observed_at": "2026-09-18T08:00:50Z"
 },
 "extensions": {
  "bureau.derived/hole": true,
  "bureau.derived/note": "Derived projection from frozen experiment evidence; the historical system did not emit this receipt.",
  "bureau.derived/note2": "This receipt records the demonstrated hole: the naive composition COMMITted a post-revocation A-origin artifact. It is evidence of the bug, not of success.",
  "bureau.derived/projection": true,
  "bureau.derived/source_artifact": "source/evidence/RESULT.json",
  "bureau.derived/source_sha256": "7baa8682ac79023c4d417a2219bdd3933abd3bc187d6d8004a5be73f6c8fa1df"
 },
 "provenance": {
  "hash": "7baa8682ac79023c4d417a2219bdd3933abd3bc187d6d8004a5be73f6c8fa1df",
  "source_ref": "source/evidence/RESULT.json",
  "system": "trust-handoff-001 (derived projection)"
 },
 "receipt_id": "th-004-naive-hole",
 "receipt_version": "bureau.receipt.v0.1",
 "receiver": "trust-handoff-001/naive-receiver",
 "timestamp": "2026-09-18T08:00:50Z"
}
