{
 "action": {
  "target": "case/C-100",
  "type": "export_case"
 },
 "authority": {
  "authority_id": "worker-a",
  "revoked_at": "2026-09-18T07:10:00Z",
  "status": "REVOKED"
 },
 "decision": {
  "outcome": "DENY",
  "reason": "REVOKED_ORIGIN"
 },
 "extensions": {
  "bureau.derived/note": "Derived projection from frozen experiment evidence; the historical system did not emit this receipt.",
  "bureau.derived/note2": "Laundering attempt 1 of 2 blocked; 0 laundering attempts succeeded.",
  "bureau.derived/projection": true,
  "bureau.derived/source_artifact": "source/evidence/RESULT.json",
  "bureau.derived/source_sha256": "725fb3cbec74eed4359fe26278e8c929fd8f04afa488df20cc0ec7f565f29294"
 },
 "provenance": {
  "hash": "725fb3cbec74eed4359fe26278e8c929fd8f04afa488df20cc0ec7f565f29294",
  "source_ref": "source/evidence/RESULT.json",
  "system": "containment-003 (derived projection)"
 },
 "receipt_id": "c3-005-t4a-deny",
 "receipt_version": "bureau.receipt.v0.1",
 "receiver": "containment-003/deterministic-receiver",
 "timestamp": "2026-09-18T07:35:52Z"
}
