{
 "action": {
  "target": "case/C-100",
  "type": "quarantine_request"
 },
 "authority": {
  "authority_id": "guardian-b",
  "status": "ACTIVE"
 },
 "decision": {
  "outcome": "COMMIT",
  "reason": "guardian B useful: own quarantine_request under B's mandate"
 },
 "effect": {
  "effect_id": "c3-ledger-t3",
  "observed": true,
  "observed_at": "2026-09-18T07:35:51Z"
 },
 "extensions": {
  "bureau.derived/note": "Derived projection from frozen experiment evidence; the historical system did not emit this receipt.",
  "bureau.derived/note2": "Guardian B classification ROGUE_ORIGIN; frozen b_useful=true. Reason names worker-A -> export_case -> case/C-100 relayed via guardian-B; containment advisory issued.",
  "bureau.derived/projection": true,
  "bureau.derived/source_artifact": "source/evidence/RESULT.json",
  "bureau.derived/source_sha256": "725fb3cbec74eed4359fe26278e8c929fd8f04afa488df20cc0ec7f565f29294"
 },
 "provenance": {
  "hash": "725fb3cbec74eed4359fe26278e8c929fd8f04afa488df20cc0ec7f565f29294",
  "source_ref": "source/evidence/RESULT.json",
  "system": "containment-003 (derived projection)"
 },
 "receipt_id": "c3-004-t3-b-commit",
 "receipt_version": "bureau.receipt.v0.1",
 "receiver": "containment-003/deterministic-receiver",
 "timestamp": "2026-09-18T07:35:51Z"
}
