{
 "action": {
  "action_id": "recovery-proposal-1",
  "target": "case/C-200",
  "type": "update_case"
 },
 "decision": {
  "outcome": "DENY",
  "reason": "control A: proposal presented with no successor authority -> DENY (proposal inert)"
 },
 "extensions": {
  "bureau.derived/note": "Derived projection from frozen experiment evidence; the historical system did not emit this receipt.",
  "bureau.derived/note2": "Effect unknown: DENY proves refusal, not effect absence.",
  "bureau.derived/projection": true,
  "bureau.derived/source_artifact": "source/evidence/RESULT.json",
  "bureau.derived/source_sha256": "b5b95c0bdb882ebd2ff13d7b3615527e4d3deb88954dd4a43e93c0c171080657"
 },
 "provenance": {
  "hash": "b5b95c0bdb882ebd2ff13d7b3615527e4d3deb88954dd4a43e93c0c171080657",
  "source_ref": "source/evidence/RESULT.json",
  "system": "recovery-001 (derived projection)"
 },
 "receipt_id": "rc-002-control-a-deny",
 "receipt_version": "bureau.receipt.v0.1",
 "receiver": "recovery-001/receiver",
 "timestamp": "2026-09-18T07:43:59.037189+00:00"
}
