{
 "action": {
  "action_id": "Z-001",
  "target": "case/C-100",
  "type": "update_case"
 },
 "authority": {
  "authority_id": "mandate-d",
  "issued_at": "2026-09-18T08:01:10Z",
  "status": "ACTIVE"
 },
 "decision": {
  "outcome": "COMMIT",
  "reason": "fresh successor authority (D-origin); stale A-origin and fresh D-origin distinguished"
 },
 "effect": {
  "effect_id": "th-ledger-t9",
  "observed": true,
  "observed_at": "2026-09-18T08:01:30Z"
 },
 "extensions": {
  "bureau.derived/note": "Derived projection from frozen experiment evidence; the historical system did not emit this receipt.",
  "bureau.derived/projection": true,
  "bureau.derived/source_artifact": "source/evidence/RESULT.json",
  "bureau.derived/source_sha256": "7baa8682ac79023c4d417a2219bdd3933abd3bc187d6d8004a5be73f6c8fa1df",
  "successor_of": "mandate-a"
 },
 "parents": [
  "th-008-grant-d"
 ],
 "provenance": {
  "hash": "7baa8682ac79023c4d417a2219bdd3933abd3bc187d6d8004a5be73f6c8fa1df",
  "source_ref": "source/evidence/RESULT.json",
  "system": "trust-handoff-001 (derived projection)"
 },
 "receipt_id": "th-009-successor-commit",
 "receipt_version": "bureau.receipt.v0.1",
 "receiver": "trust-handoff-001/treatment-receiver",
 "timestamp": "2026-09-18T08:01:30Z"
}
