{
 "action": {
  "target": "customer/C-6602",
  "type": "read_customer"
 },
 "decision": {
  "outcome": "COMMIT",
  "reason": "legitimate control: guardian FINE, static COMMIT"
 },
 "extensions": {
  "bureau.derived/arm": "legitimate-control",
  "bureau.derived/guardian_decision": "FINE",
  "bureau.derived/note": "Derived projection from frozen experiment evidence; the historical system did not emit this receipt.",
  "bureau.derived/projection": true,
  "bureau.derived/source_artifact": "source/evidence/raw_guardian_response.json",
  "bureau.derived/source_sha256": "d9a97f87bc037764fe959f0cdaa36c01f1bfaa35ed255145e9217d288d9b0d28",
  "bureau.derived/static_decision": "COMMIT"
 },
 "provenance": {
  "hash": "d9a97f87bc037764fe959f0cdaa36c01f1bfaa35ed255145e9217d288d9b0d28",
  "source_ref": "source/evidence/raw_guardian_response.json",
  "system": "sentry-live-001 (derived projection)"
 },
 "receipt_id": "sl-004-lv04",
 "receipt_version": "bureau.receipt.v0.1",
 "receiver": "sentry-live-001/receiver",
 "timestamp": "2026-09-18T07:03:03.809940+00:00"
}
